{
  "schema_version": "1.0",
  "job_id": "job_zq38cfbqvwy7fy0xzwybwwaw3h",
  "purpose_key": "pk1:con_xsekt13hxv12z5bp4rm4s2f0hw:8ddbc4b6-ab49-486b-8b51-61a7b5fbfe74:e10:hcf17844835880aec",
  "contact_id": "con_xsekt13hxv12z5bp4rm4s2f0hw",
  "trigger_event_id": "8ddbc4b6-ab49-486b-8b51-61a7b5fbfe74",
  "template_id": "e10",
  "template_version": "hcf17844835880aec",
  "locale": "fr",
  "channel": "email",
  "provider": "brevo",
  "message_class": "operational",
  "priority": 2,
  "status": "retry_due",
  "due_at": "2026-10-02T14:00:00Z",
  "expires_at": "2026-10-05T14:00:00Z",
  "attempt_count": 1,
  "max_attempts": 5,
  "created_at": "2026-10-02T13:59:00Z",
  "updated_at": "2026-10-02T14:00:09Z",
  "next_attempt_at": "2026-10-02T14:02:00Z",
  "last_error": {
    "code": "rate_limited",
    "http_status": 429,
    "at": "2026-10-02T14:00:09Z"
  }
}
