{
  "schema_version": "1.0",
  "job_id": "job_c68fn2v5253jsca5b6rs8hbtjf",
  "purpose_key": "pk1:con_xsekt13hxv12z5bp4rm4s2f0hw:255dc180-3124-49ac-b5e3-1b4a158d5a98:e04:h83a82f34a57b5f33",
  "contact_id": "con_xsekt13hxv12z5bp4rm4s2f0hw",
  "trigger_event_id": "255dc180-3124-49ac-b5e3-1b4a158d5a98",
  "template_id": "e04",
  "template_version": "h83a82f34a57b5f33",
  "locale": "fr",
  "channel": "email",
  "provider": "brevo",
  "message_class": "promotional",
  "priority": 7,
  "status": "retry_due",
  "due_at": "2026-10-02T20:00:00Z",
  "expires_at": "2026-10-07T20:00:00Z",
  "attempt_count": 0,
  "max_attempts": 5,
  "created_at": "2026-10-02T13:59:00Z",
  "updated_at": "2026-10-02T20:00:03Z",
  "consent_reference": "cev_0rv6kbtcg8zyd6m76tv1pmxp7d",
  "next_attempt_at": "2026-10-03T04:00:00Z",
  "defer_reason": "daily_budget"
}
